### ISSUE TITLE
Applet fails to close TCP connections to yahoo API

### ISSUE THREAD

**Issue by hcgpalm** [mockturtl/cinnamon-weather#30]
As evident from the output from netstat -a, cinnamon-weather leaves half closed TCP connections to yahoo around:
$ netstat -a|grep yts1
tcp        1      0 x200:35402              yts1.yql.vip.bf1.y:http CLOSE_WAIT 
tcp        1      1 x200:35386              yts1.yql.vip.bf1.y:http LAST_ACK

A tcpdump shows the following packet exchange:
1. The applet receives and acknowledges the HTTP 200 OK response:
   15  0.266592    98.137.200.255  192.168.0.3 HTTP    500 HTTP/1.1 200 OK  (application/json)
   16  0.266624    192.168.0.3 98.137.200.255  TCP 66  35372 > http [ACK] Seq=204 Ack=3671 Win=24448 Len=0 TSval=182851835 TSecr=1698031673
2. Yahoo closes their end of the connection after 42 seconds:
   35  42.259145   98.137.200.255  192.168.0.3 TCP 66  http > 35372 [FIN, ACK] Seq=3671 Ack=204 Win=15616 Len=0 TSval=1698073668 TSecr=182851835
   36  42.299132   192.168.0.3 98.137.200.255  TCP 66  35372 > http [ACK] Seq=204 Ack=3672 Win=24448 Len=0 TSval=182893868 TSecr=1698073668
3. The applet closes its end of the connection about ~200 seconds later:
   43  239.999817  192.168.0.3 98.137.200.255  TCP 66  35372 > http [FIN, ACK] Seq=204 Ack=3672 Win=24448 Len=0 TSval=183091568 TSecr=1698073668
4. Apparently this is too late because we get an RST packet in response:
   45  240.129587  98.137.200.255  192.168.0.3 TCP 54  http > 35372 [RST] Seq=3672 Win=0 Len=0
5. Linux obviously doesn't want RST packets in this state:
   46  240.129667  192.168.0.3 98.137.200.255  ICMP    82  Destination unreachable (Host administratively prohibited)
6. So the client happily re-tries the close:
   59  240.390140  192.168.0.3 98.137.200.255  TCP 66  35372 > http [FIN, ACK] Seq=204 Ack=3672 Win=24448 Len=0 TSval=183091959 TSecr=1698073668
7. And the process (4-6) repeats until we give up...

From this, it seems that the applet attempts to keep a persistent connection to the REST service. However, given that the default (and given the application, any reasonable) update interval is in the order of minutes, this is perhaps not a very good idea. So the simple solution would be to close the connection immediately after each call.
